{
  "$schema": "./fabric-items.schema.json",
  "schemaVersion": 1,
  "workspaces": [
    {
      "key": "rtiIngress",
      "purpose": "Isolated Eventstream publisher blast radius, Eventhouse/KQL, landing Lakehouse, and RTI assets.",
      "parameterPath": "workspaces.rtiIngress"
    },
    {
      "key": "dataCore",
      "purpose": "Curated core Lakehouse, notebooks, and Data Pipelines; no ingress publisher access.",
      "parameterPath": "workspaces.dataCore"
    },
    {
      "key": "ml",
      "purpose": "Fabric Data Science, experiments, evaluations, and approved model artifacts.",
      "parameterPath": "workspaces.ml"
    },
    {
      "key": "analytics",
      "purpose": "Direct Lake semantic model and Power BI/board reporting.",
      "parameterPath": "workspaces.analytics"
    }
  ],
  "items": [
    {
      "key": "eventhouseOperations",
      "type": "Eventhouse",
      "displayName": "evh-ns-operations",
      "description": "NovaSteel hot operational Eventhouse.",
      "workspaceKey": "rtiIngress",
      "automationTier": "automaticAfterTenantGate",
      "deploymentOption": "deployRti",
      "restCollection": "/eventhouses",
      "sourceDirectory": "items/evh-ns-operations.Eventhouse",
      "definitionFormat": null,
      "definitionParts": [],
      "createWithoutDefinition": true,
      "cliDeployable": false,
      "bindingGate": null,
      "dependencies": [],
      "manualGates": [
        "Confirm the workspace is assigned to a running supported Fabric capacity.",
        "Validate retention/cache cost and cold-start behavior in the target tenant."
      ]
    },
    {
      "key": "landingLakehouse",
      "type": "Lakehouse",
      "displayName": "lh-ns-landing",
      "description": "Immutable bronze envelopes and quarantine landing.",
      "workspaceKey": "rtiIngress",
      "automationTier": "automaticAfterTenantGate",
      "deploymentOption": "deployLakehouses",
      "restCollection": "/lakehouses",
      "sourceDirectory": "items/lh-ns-landing.Lakehouse",
      "definitionFormat": null,
      "definitionParts": [],
      "createWithoutDefinition": true,
      "cliDeployable": false,
      "bindingGate": null,
      "dependencies": [],
      "manualGates": [
        "Apply and verify current OneLake security roles and sensitivity label.",
        "Verify that no shortcut crosses the demo/non-demo boundary."
      ]
    },
    {
      "key": "coreLakehouse",
      "type": "Lakehouse",
      "displayName": "lh-ns-core",
      "description": "Typed silver facts, SCD dimensions, and gold KPI tables.",
      "workspaceKey": "dataCore",
      "automationTier": "automaticAfterTenantGate",
      "deploymentOption": "deployLakehouses",
      "restCollection": "/lakehouses",
      "sourceDirectory": "items/lh-ns-core.Lakehouse",
      "definitionFormat": null,
      "definitionParts": [],
      "createWithoutDefinition": true,
      "cliDeployable": false,
      "bindingGate": null,
      "dependencies": [],
      "manualGates": [
        "Apply and verify current OneLake security roles and sensitivity label.",
        "Confirm the workspace identity/notebook identity can read landing and write core only."
      ]
    },
    {
      "key": "kqlOperations",
      "type": "KQLDatabase",
      "displayName": "kql-ns-operations",
      "description": "Hot telemetry, alarms, gateway health, inference, and quarantine.",
      "workspaceKey": "rtiIngress",
      "automationTier": "automaticAfterTenantGate",
      "deploymentOption": "deployRti",
      "restCollection": "/kqlDatabases",
      "sourceDirectory": "items/kql-ns-operations.KQLDatabase",
      "definitionFormat": null,
      "definitionParts": [
        "DatabaseProperties.json",
        "DatabaseSchema.kql",
        ".platform"
      ],
      "createWithoutDefinition": false,
      "cliDeployable": true,
      "bindingGate": null,
      "dependencies": ["eventhouseOperations"],
      "manualGates": [
        "Measure retention/cache cost and adjust environment retention values.",
        "Confirm KQL query/ingestion endpoints and item identity support before production."
      ]
    },
    {
      "key": "notebookInitialize",
      "type": "Notebook",
      "displayName": "ns-initialize-lakehouses",
      "description": "Create Delta medallion tables and reference targets idempotently.",
      "workspaceKey": "dataCore",
      "automationTier": "automaticAfterTenantGate",
      "deploymentOption": "deployNotebooks",
      "restCollection": "/notebooks",
      "sourceDirectory": "notebooks/ns-initialize-lakehouses.Notebook",
      "definitionFormat": "fabricGitSource",
      "definitionParts": ["notebook-content.py", ".platform"],
      "createWithoutDefinition": false,
      "cliDeployable": true,
      "bindingGate": null,
      "dependencies": ["landingLakehouse", "coreLakehouse"],
      "manualGates": [
        "Attach or authorize the landing/core Lakehouses for the notebook execution identity."
      ]
    },
    {
      "key": "notebookBronzeToSilver",
      "type": "Notebook",
      "displayName": "ns-bronze-to-silver",
      "description": "Validate, deduplicate, normalize, SCD-resolve, and quarantine bronze events.",
      "workspaceKey": "dataCore",
      "automationTier": "automaticAfterTenantGate",
      "deploymentOption": "deployNotebooks",
      "restCollection": "/notebooks",
      "sourceDirectory": "notebooks/ns-bronze-to-silver.Notebook",
      "definitionFormat": "fabricGitSource",
      "definitionParts": ["notebook-content.py", ".platform"],
      "createWithoutDefinition": false,
      "cliDeployable": true,
      "bindingGate": null,
      "dependencies": ["notebookInitialize"],
      "manualGates": [
        "Validate event-time SCD joins, unit registry, watermark, and replay behavior with a fixed batch."
      ]
    },
    {
      "key": "notebookSilverToGold",
      "type": "Notebook",
      "displayName": "ns-silver-to-gold",
      "description": "Build governed daily/shift KPI facts and decision/audit projections.",
      "workspaceKey": "dataCore",
      "automationTier": "automaticAfterTenantGate",
      "deploymentOption": "deployNotebooks",
      "restCollection": "/notebooks",
      "sourceDirectory": "notebooks/ns-silver-to-gold.Notebook",
      "definitionFormat": "fabricGitSource",
      "definitionParts": ["notebook-content.py", ".platform"],
      "createWithoutDefinition": false,
      "cliDeployable": true,
      "bindingGate": null,
      "dependencies": ["notebookBronzeToSilver"],
      "manualGates": [
        "Business owners must sign off KPI definitions before production reporting."
      ]
    },
    {
      "key": "notebookDemoScoring",
      "type": "Notebook",
      "displayName": "ns-deterministic-demo-scoring",
      "description": "Synthetic-only deterministic RUL and quality demo scoring.",
      "workspaceKey": "ml",
      "automationTier": "automaticAfterTenantGate",
      "deploymentOption": "deployNotebooks",
      "restCollection": "/notebooks",
      "sourceDirectory": "notebooks/ns-deterministic-demo-scoring.Notebook",
      "definitionFormat": "fabricGitSource",
      "definitionParts": ["notebook-content.py", ".platform"],
      "createWithoutDefinition": false,
      "cliDeployable": true,
      "bindingGate": null,
      "dependencies": ["coreLakehouse"],
      "manualGates": [
        "Run only against SYNTHETIC data; this rule-based scorer is not a promoted production model.",
        "A production model requires MLflow evaluation, model card, drift gates, and RAI approval."
      ]
    },
    {
      "key": "notebookDataQuality",
      "type": "Notebook",
      "displayName": "ns-validate-data-quality",
      "description": "Reconciliation, contract, physical, and scenario quality gate.",
      "workspaceKey": "dataCore",
      "automationTier": "automaticAfterTenantGate",
      "deploymentOption": "deployNotebooks",
      "restCollection": "/notebooks",
      "sourceDirectory": "notebooks/ns-validate-data-quality.Notebook",
      "definitionFormat": "fabricGitSource",
      "definitionParts": ["notebook-content.py", ".platform"],
      "createWithoutDefinition": false,
      "cliDeployable": true,
      "bindingGate": null,
      "dependencies": ["notebookSilverToGold"],
      "manualGates": [
        "A run is demo-ready only when contract, physics, and scenario assertions pass."
      ]
    },
    {
      "key": "pipelineMedallion",
      "type": "DataPipeline",
      "displayName": "pl-ns-medallion",
      "description": "Initialize and run bronze-to-silver-to-gold with a quality gate.",
      "workspaceKey": "dataCore",
      "automationTier": "automaticAfterTenantGate",
      "deploymentOption": "deployPipelines",
      "restCollection": "/dataPipelines",
      "sourceDirectory": "pipelines/pl-ns-medallion.DataPipeline",
      "definitionFormat": null,
      "definitionParts": ["pipeline-content.json", ".platform"],
      "createWithoutDefinition": false,
      "cliDeployable": true,
      "bindingGate": null,
      "dependencies": [
        "notebookInitialize",
        "notebookBronzeToSilver",
        "notebookSilverToGold",
        "notebookDataQuality"
      ],
      "manualGates": [
        "Bind the current notebook job identity and test a fixed-batch row reconciliation.",
        "Configure schedules only after capacity pause windows are excluded."
      ]
    },
    {
      "key": "pipelineDemoScoring",
      "type": "DataPipeline",
      "displayName": "pl-ns-demo-scoring",
      "description": "Run deterministic synthetic scoring then refresh gold quality checks.",
      "workspaceKey": "ml",
      "automationTier": "automaticAfterTenantGate",
      "deploymentOption": "deployPipelines",
      "restCollection": "/dataPipelines",
      "sourceDirectory": "pipelines/pl-ns-demo-scoring.DataPipeline",
      "definitionFormat": null,
      "definitionParts": ["pipeline-content.json", ".platform"],
      "createWithoutDefinition": false,